number,state,contributor,created_at,closed_at,title,labels,resolution_time
2699,closed,BorisA11,2020-09-24 14:00:49+00:00,2020-09-24 14:08:42+00:00,sector time reset,['bug'],0.1313888888888889
2698,closed,BorisA11,2020-09-24 13:12:27+00:00,2020-09-24 13:16:32+00:00,shadows?,['bug'],0.06805555555555555
2697,closed,BorisA11,2020-09-24 09:50:07+00:00,2020-09-24 13:16:57+00:00,flares ai when attacking small blocks,['bug'],3.4472222222222224
2695,closed,D-player1,2020-09-24 07:17:01+00:00,2020-09-24 13:17:49+00:00,force close at sector 173,['bug'],6.013333333333334
2690,closed,Nyther,2020-09-24 01:24:39+00:00,2020-09-24 01:46:55+00:00,crash on sector time out,['bug'],0.3711111111111111
2689,closed,RedRanger5577,2020-09-23 21:45:28+00:00,2020-09-23 21:51:03+00:00,crawler leg glitch,['bug'],0.09305555555555556
2688,closed,Highfire1,2020-09-23 20:52:11+00:00,2020-09-23 21:23:09+00:00,router+sorter reduces throughput,['bug'],0.5161111111111111
2686,closed,BorisA11,2020-09-23 18:46:31+00:00,2020-09-23 19:00:21+00:00,launchpads bug,['bug'],0.23055555555555557
2683,closed,BorisA11,2020-09-23 17:07:44+00:00,2020-09-23 19:00:05+00:00,poly (builder drones) bug,['bug'],1.8725
2682,closed,rix117,2020-09-23 16:38:50+00:00,2020-09-23 19:04:04+00:00,scatter not accepting ammo,['bug'],2.4205555555555556
2681,closed,rawchords,2020-09-23 16:11:00+00:00,2020-09-23 18:58:40+00:00,savegame corrupting certain sectors,['bug'],2.7944444444444443
2680,closed,bartox1,2020-09-23 15:40:58+00:00,2020-09-23 15:48:54+00:00,game crash while joining server,['bug'],0.1322222222222222
2679,closed,XEN0PHIL,2020-09-23 13:14:54+00:00,2020-09-23 13:32:35+00:00,laser beams of corvus and vela keep firing when picked up,['bug'],0.2947222222222222
2678,closed,quanium,2020-09-23 12:21:18+00:00,2020-09-23 13:15:39+00:00,save with air/ground factory is broken,['bug'],0.9058333333333334
2677,closed,deltanedas,2020-09-23 11:59:53+00:00,2020-09-23 13:16:04+00:00,container is uncoloured when building,['bug'],1.2697222222222222
2676,closed,Slotterleet,2020-09-23 11:50:00+00:00,2020-09-23 13:16:34+00:00,private server crash (steam),['bug'],1.4427777777777777
2674,closed,BorisA11,2020-09-23 09:22:30+00:00,2020-09-23 13:17:10+00:00,factory blocks have low health on campaign maps,['bug'],3.911111111111111
2672,closed,TriPartiedLand,2020-09-23 03:15:11+00:00,2020-09-23 03:23:01+00:00,pathfinding doesn't consider slag as dangerous liquid,['bug'],0.13055555555555556
2671,closed,Cyastis,2020-09-23 02:17:59+00:00,2020-09-23 02:53:02+00:00,phase conveyors do not show the correct speed of items flowing through them,['bug'],0.5841666666666666
2670,closed,XEN0PHIL,2020-09-23 01:45:50+00:00,2020-09-23 01:48:47+00:00,mega stops too far away from damaged blocks,['bug'],0.049166666666666664
2667,closed,the-red-soul,2020-09-23 00:50:39+00:00,2020-09-23 01:49:50+00:00,bricked multiplayer server via mega unit,['bug'],0.9863888888888889
2666,closed,CornStarXL,2020-09-22 23:24:24+00:00,2020-09-22 23:34:20+00:00,collection of issues in v6 ,['unlabeled'],0.16555555555555557
2665,closed,CornStarXL,2020-09-22 23:01:29+00:00,2020-09-22 23:09:54+00:00,collection of errors in v6,['bug'],0.14027777777777778
2663,closed,Perrito317,2020-09-22 21:36:54+00:00,2020-09-22 21:41:19+00:00,build: 9871,['bug'],0.07361111111111111
2662,closed,tezlm,2020-09-22 17:35:27+00:00,2020-09-22 17:38:13+00:00,"you can delete enemy walls by ""upgrading"" them",['bug'],0.04611111111111111
2661,closed,A5TR0spud,2020-09-22 17:13:43+00:00,2020-09-22 17:14:12+00:00,mega ai lags,['bug'],0.008055555555555555
2659,closed,Star98Blazer,2020-09-22 15:36:19+00:00,2020-09-22 17:45:14+00:00,multiplayer crashing me and my friends game,['bug'],2.1486111111111112
2658,closed,Surviavlist,2020-09-22 15:28:38+00:00,2020-09-22 15:43:08+00:00,bug report,['bug'],0.24166666666666667
2657,closed,EntropyAuthor,2020-09-22 13:37:11+00:00,2020-09-22 13:50:01+00:00,buggy audio,['bug'],0.21388888888888888
2656,closed,EntropyAuthor,2020-09-22 13:20:06+00:00,2020-09-22 13:22:28+00:00,mega ai,['bug'],0.03944444444444444
2655,closed,zyropz,2020-09-22 10:49:27+00:00,2020-09-22 13:20:42+00:00,unloader on turret didn't works,['bug'],2.5208333333333335
2654,closed,BorisA11,2020-09-22 10:18:31+00:00,2020-09-22 14:03:19+00:00,super fast bulets,['bug'],3.7466666666666666
2653,closed,BorisA11,2020-09-22 10:15:44+00:00,2020-09-22 13:28:49+00:00,weird behavior of t4 support mech,['bug'],3.2180555555555554
2652,closed,Wencelsav,2020-09-22 09:51:26+00:00,2020-09-22 13:20:40+00:00,6.0,['bug'],3.487222222222222
2651,closed,RebornTrack970,2020-09-22 06:35:19+00:00,2020-09-22 14:03:19+00:00,game crash when t5 ground support fires lazer at t5 air support and lazer hits a plast wall.,['bug'],7.466666666666667
2650,closed,Syncinus,2020-09-22 04:07:43+00:00,2020-09-22 13:20:07+00:00,corvus legs appear through the blank part in it's body,['bug'],9.206666666666667
2646,closed,Excavator987,2020-09-21 18:30:40+00:00,2020-09-21 18:35:45+00:00,some units look squashed in core database,['bug'],0.08472222222222223
2645,closed,davlucas,2020-09-21 18:27:36+00:00,2020-09-21 18:30:22+00:00,impossible to apply a litle mods,['bug'],0.04611111111111111
2644,closed,Nikolass1000,2020-09-21 17:27:10+00:00,2020-09-21 17:37:43+00:00,air support units resupply point bug,['bug'],0.17583333333333334
2642,closed,Lukas0374,2020-09-21 13:31:04+00:00,2020-09-21 13:33:54+00:00,fungal pass mech factory missing,['bug'],0.04722222222222222
2641,closed,Shaneilenin,2020-09-21 12:45:54+00:00,2020-09-21 13:09:57+00:00,campaign multiplayer is not fixed,['bug'],0.4008333333333333
2640,closed,CaptainCosmotic,2020-09-21 09:46:19+00:00,2020-09-21 13:10:23+00:00,turret ammo counter don't fill completly,['bug'],3.401111111111111
2635,closed,Syncinus,2020-09-21 01:00:37+00:00,2020-09-21 01:24:59+00:00,"railgun ""shot"" gets more spread out the lower fps is",['bug'],0.4061111111111111
2633,closed,deltanedas,2020-09-20 19:32:36+00:00,2020-09-20 19:34:04+00:00,java.lang.byte is forbidden for scripts,['bug'],0.024444444444444446
2632,closed,deltanedas,2020-09-20 19:11:47+00:00,2020-09-20 19:23:46+00:00,modded blocks are unresearched after update or restart,['bug'],0.19972222222222222
2631,closed,D-player1,2020-09-20 17:42:00+00:00,2020-09-20 17:45:39+00:00,mega ai,['bug'],0.060833333333333336
2629,closed,bartox1,2020-09-20 15:23:21+00:00,2020-09-20 17:14:18+00:00,auto save's aren't reliable.,['bug'],1.8491666666666666
2627,closed,way-zer,2020-09-20 11:12:49+00:00,2020-09-20 13:27:12+00:00,repairai is lag for server,['bug'],2.2397222222222224
2625,closed,younggam,2020-09-20 05:21:15+00:00,2020-09-20 08:26:55+00:00,build is something wrong,['bug'],3.0944444444444446
2623,closed,Draco18s,2020-09-20 00:50:49+00:00,2020-09-20 00:54:44+00:00,6.0 alpha - area that cannot be built on,['bug'],0.06527777777777778
2622,closed,Syncinus,2020-09-19 21:30:35+00:00,2020-09-19 21:35:37+00:00,console [i] statement is lagging the game,['bug'],0.08388888888888889
2621,closed,Draco18s,2020-09-19 20:25:15+00:00,2020-09-19 21:10:23+00:00,6.0 and multiplayer (techtree issue upon enabling the 6.0 alpha),['bug'],0.7522222222222222
2620,closed,Celelste,2020-09-19 19:58:01+00:00,2020-10-17 17:13:18+00:00,campaign saves being replaced,['bug'],669.2547222222222
2619,closed,Medicinexs,2020-09-19 18:48:30+00:00,2020-09-19 19:16:25+00:00,200 enemies at round 3,['bug'],0.4652777777777778
2618,closed,Ignacy-s,2020-09-19 17:50:14+00:00,2020-09-19 17:57:27+00:00,auto update not working on android be build.,['bug'],0.12027777777777778
2617,closed,Nikolass1000,2020-09-19 17:03:36+00:00,2020-09-19 17:26:00+00:00,mega dont drops block when dies,['bug'],0.37333333333333335
2616,closed,Mothership007,2020-09-19 15:43:02+00:00,2020-09-19 16:20:18+00:00,bug report steam 6.0. alpha testing,['bug'],0.6211111111111111
2614,closed,bartox1,2020-09-19 14:28:32+00:00,2020-09-19 16:26:52+00:00,invornable units,['bug'],1.9722222222222223
2613,closed,ethandudu,2020-09-19 13:48:45+00:00,2020-09-19 16:13:38+00:00,multipalayer server crash when someone break a block,['bug'],2.414722222222222
2611,closed,PaintedCat,2020-09-19 10:06:01+00:00,2020-09-19 16:17:24+00:00,much robots,['bug'],6.189722222222223
2608,closed,DarkBrick,2020-09-19 08:55:23+00:00,2020-09-19 16:13:03+00:00,misc bugs involving undoing deleting blocks in the editor,['bug'],7.294444444444444
2607,closed,sk7725,2020-09-19 08:31:30+00:00,2020-09-19 16:31:10+00:00,armored conduit refuses to conform to its identity of being a conduit,['bug'],7.9944444444444445
2606,closed,iLagSoUhax,2020-09-19 08:12:01+00:00,2020-09-19 16:15:58+00:00,ships leave water trail on land.,['bug'],8.065833333333334
2605,closed,Excavator987,2020-09-19 07:38:07+00:00,2020-09-19 16:15:40+00:00,grass looks gray in editor select screen,['bug'],8.625833333333333
2604,closed,ghost,2020-09-19 05:31:31+00:00,2020-09-19 16:31:10+00:00,"bug/exploit, arc / lancer is able to fire without draining power when not connected to any power draining blocks and connected to one solar panel",['bug'],10.994166666666667
2603,closed,XEN0PHIL,2020-09-19 04:25:13+00:00,2020-09-19 16:18:53+00:00,units inside mega do not count towards unit limit,['bug'],11.894444444444444
2602,closed,sk7725,2020-09-19 02:26:42+00:00,2020-09-19 16:26:39+00:00,overlapping cached blocks graphical bug,['bug'],13.999166666666667
2601,closed,XEN0PHIL,2020-09-19 02:14:14+00:00,2020-09-19 02:23:39+00:00,t5 naval unit fills whole air build limit,['bug'],0.15694444444444444
2600,closed,Esnardo,2020-09-19 01:39:16+00:00,2020-09-19 02:26:15+00:00,conveyor corners shake,['bug'],0.7830555555555555
2599,closed,Syncinus,2020-09-19 01:06:42+00:00,2020-09-19 01:08:23+00:00,"legs units legs go through the black area, but the unit can't move over it",['bug'],0.028055555555555556
2598,closed,Legomonster33,2020-09-19 01:02:24+00:00,2020-09-19 01:10:15+00:00,[reupload] logic displays break at high fps (this time with a save file),['bug'],0.13083333333333333
2597,closed,Legomonster33,2020-09-18 23:57:32+00:00,2020-09-19 00:13:20+00:00,logic displays break at high fps,['bug'],0.2633333333333333
2596,closed,rodrigolitzius,2020-09-18 23:52:09+00:00,2020-09-18 23:53:28+00:00,you can't upgrade t3 units to t4 units (naval units at least),['bug'],0.021944444444444444
2593,closed,iLagSoUhax,2020-09-18 15:31:04+00:00,2020-09-18 15:32:14+00:00,grass is gray?,['bug'],0.019444444444444445
2592,closed,Remint32,2020-09-18 15:05:42+00:00,2020-09-18 15:17:30+00:00,visual glitches in star-system menu,['bug'],0.19666666666666666
2591,closed,DarkBrick,2020-09-18 12:37:48+00:00,2020-09-18 15:22:07+00:00,core sprite appears incorrectly when resizeing maps in the editor,['bug'],2.738611111111111
2590,closed,Celelste,2020-09-18 09:32:02+00:00,2020-09-18 15:22:14+00:00,clearing game data clears tech tree but keeps all other campaign data,['bug'],5.836666666666667
2589,closed,Excavator987,2020-09-18 07:16:42+00:00,2020-09-18 15:22:07+00:00,mud in editor,['bug'],8.090277777777779
2588,closed,Lazaro797,2020-09-18 05:37:30+00:00,2020-09-18 14:14:23+00:00,error loading pixmap: corrupt jpeg,['bug'],8.614722222222222
2587,closed,the-red-soul,2020-09-18 05:05:28+00:00,2020-09-18 15:22:07+00:00,commanded units stop following,['bug'],10.2775
2586,closed,unknownzzzz,2020-09-18 03:36:50+00:00,2020-09-18 03:44:52+00:00,menu tiles not fixed.,['bug'],0.1338888888888889
2585,closed,the-red-soul,2020-09-18 02:12:29+00:00,2020-09-18 02:26:02+00:00,items in research menu are not coloured red ,['bug'],0.22583333333333333
2584,closed,unknownzzzz,2020-09-18 02:04:51+00:00,2020-09-18 02:17:49+00:00,"campaign, first map behaving weird.",['bug'],0.21611111111111111
2583,closed,unknownzzzz,2020-09-18 02:01:19+00:00,2020-09-18 02:17:26+00:00,fps showing incorrectly or setting incorrectly.,['bug'],0.26861111111111113
2582,closed,ninjassifi,2020-09-17 19:04:43+00:00,2020-10-17 18:38:00+00:00,unhittable units,['bug'],719.5547222222223
2581,closed,CaptainCosmotic,2020-09-17 17:53:43+00:00,2020-09-17 18:16:51+00:00,building shortcut info hide map exit button,['bug'],0.38555555555555554
2580,closed,ghost,2020-09-17 17:00:56+00:00,2020-09-17 18:04:51+00:00,custom game planet system,['unlabeled'],1.0652777777777778
2578,closed,neil11008,2020-09-17 15:30:04+00:00,2020-09-17 15:31:56+00:00,android game input schematic bug,['bug'],0.03111111111111111
2574,closed,iLagSoUhax,2020-09-17 11:56:34+00:00,2020-09-17 13:10:38+00:00,irregular tech tree connection,['bug'],1.2344444444444445
2573,closed,djradnad,2020-09-17 10:54:36+00:00,2020-09-17 13:12:04+00:00,campaign co-op client building bug.,['bug'],2.2911111111111113
2571,closed,the-red-soul,2020-09-17 03:20:54+00:00,2020-09-17 03:35:01+00:00,unit vanishes after placing on payload conveyor,['bug'],0.23527777777777778
2570,closed,Cpppppppppplus,2020-09-16 19:49:18+00:00,2020-09-18 02:20:58+00:00,sector copied and overwrites other sector,['bug'],30.52777777777778
2567,closed,ninjassifi,2020-09-16 16:52:35+00:00,2020-09-16 16:56:39+00:00,unit production speed (custom game settings) is not affecting reconstructors.,['bug'],0.06777777777777778
2566,closed,Excavator987,2020-09-16 15:15:51+00:00,2020-09-19 16:27:51+00:00,using undo and redo in editor,['bug'],73.2
2565,closed,Excavator987,2020-09-16 15:09:24+00:00,2020-09-16 15:44:51+00:00,message block and memory cell sprites switched in editor,['bug'],0.5908333333333333
2563,closed,Kokolyb,2020-09-16 12:12:49+00:00,2020-09-16 13:24:03+00:00,resuming other sector,['bug'],1.1872222222222222
2556,closed,Kokolyb,2020-09-15 17:22:48+00:00,2020-09-15 17:47:06+00:00,crash when i deconstructed a bridge conveyor,['bug'],0.405
2555,closed,Plagueboi,2020-09-15 15:38:24+00:00,2020-09-15 15:43:16+00:00,phase fabric wall,['bug'],0.0811111111111111
2554,closed,enigmafyv,2020-09-14 16:07:08+00:00,2020-09-14 16:20:50+00:00,ui scaling - broken button images,['bug'],0.22833333333333333
2553,closed,ChingSteven,2020-09-14 14:44:50+00:00,2020-09-14 15:13:40+00:00,bug report,['bug'],0.48055555555555557
2551,closed,genNAowl,2020-09-14 04:27:04+00:00,2020-09-14 13:42:07+00:00,"after beating a sector, the skip wave part stays?",['bug'],9.250833333333333
2550,closed,tezlm,2020-09-14 00:32:05+00:00,2020-09-14 02:00:32+00:00,dark areas hide power node connections,['bug'],1.4741666666666666
2548,closed,sk7725,2020-09-13 01:40:53+00:00,2020-09-13 01:44:33+00:00,extending buildings broke in latest build,['bug'],0.06111111111111111
2546,closed,Shawak,2020-09-12 22:26:39+00:00,2020-09-12 22:33:19+00:00,workshop description bug,['bug'],0.1111111111111111
2545,closed,Syncinus,2020-09-12 19:28:04+00:00,2020-09-12 22:33:00+00:00,ground units walking looks visually messed up.,['bug'],3.082222222222222
2544,closed,dajmnogat,2020-09-12 18:39:33+00:00,2020-09-12 18:57:05+00:00,"i've barely  used github, so sorry for any mistakes.:  platform: windows.  build: bleeding-edge 9664.  issue: the core gets destroyed but the game doesn't end, resulting in  the  game crashing when i launch the core.  ",['bug'],0.2922222222222222
2543,closed,Excavator987,2020-09-12 13:20:18+00:00,2020-09-12 13:25:26+00:00,water extractors having power after dropped away from power,['bug'],0.08555555555555555
2537,closed,Prosta4okua,2020-09-10 23:31:02+00:00,2020-09-11 02:20:31+00:00,crashes,['bug'],2.8247222222222224
2536,closed,ASFRedstone,2020-09-10 22:27:55+00:00,2020-09-10 23:09:08+00:00,no limit on when you can launch in the latest build,['bug'],0.6869444444444445
2534,closed,SownGryphon,2020-09-10 22:15:27+00:00,2020-09-10 23:05:34+00:00,broken bridge conveyors,['bug'],0.8352777777777778
2533,closed,Crewm8,2020-09-10 20:12:20+00:00,2020-09-10 20:15:36+00:00,reaserch bug on 9630,['bug'],0.05444444444444444
2532,closed,Crewm8,2020-09-10 20:11:43+00:00,2020-09-10 20:13:15+00:00,transfer data from pc to android,['bug'],0.025555555555555557
2530,closed,sk7725,2020-09-10 07:27:48+00:00,2020-09-10 13:24:30+00:00,plastanium conveyor graphical bug,['bug'],5.945
2529,closed,Slotterleet,2020-09-10 05:00:16+00:00,2020-09-10 13:21:02+00:00,v6 mods don't load,['bug'],8.346111111111112
2527,closed,ghost,2020-09-09 23:52:54+00:00,2020-09-09 23:59:03+00:00,2 logic blocks can't select a block under them,['bug'],0.1025
2526,closed,Kirusha28,2020-09-09 19:59:53+00:00,2020-09-09 20:13:25+00:00,crashes when you put a block from the mod,['bug'],0.22555555555555556
2525,closed,Danil006,2020-09-09 18:55:28+00:00,2020-09-09 19:01:29+00:00,mindustrty 6.0 launch error,['unlabeled'],0.10027777777777777
2524,closed,SVlad11825,2020-09-09 15:46:06+00:00,2020-09-09 16:49:23+00:00,"romanian bundle loading successfully, but strings don't show up",['bug'],1.0547222222222221
2522,closed,cyphercollider,2020-09-09 03:45:46+00:00,2020-09-09 13:14:58+00:00,stack overflow error,['bug'],9.486666666666666
2520,closed,pixaxeofpixie,2020-09-08 19:28:41+00:00,2020-09-08 19:59:26+00:00,it's me again.mac dont launch.,['bug'],0.5125
2519,closed,pixaxeofpixie,2020-09-08 18:47:09+00:00,2020-09-08 18:48:58+00:00,unsupported major minor version 52.0,['bug'],0.03027777777777778
2515,closed,ghost,2020-09-07 19:48:33+00:00,2020-09-07 21:07:06+00:00,genearte tool doesn't work,['bug'],1.3091666666666666
2512,closed,cyphercollider,2020-09-07 05:11:58+00:00,2020-09-07 13:28:05+00:00,save bug on bleeding edge,['bug'],8.268611111111111
2507,closed,deltanedas,2020-09-06 18:49:09+00:00,2020-09-06 18:54:16+00:00,call.requestitem will delete items if unit inventory is full,['bug'],0.08527777777777777
2506,closed,pixaxeofpixie,2020-09-06 18:25:30+00:00,2020-09-06 18:30:40+00:00,mindustry/mindustry be doesn't launch in mac.,['bug'],0.08611111111111111
2505,closed,deltanedas,2020-09-06 18:04:28+00:00,2020-09-06 18:30:12+00:00,script errors do not show up as a mod error,['bug'],0.4288888888888889
2504,closed,mse-k,2020-09-06 17:37:06+00:00,2020-09-06 17:46:04+00:00,be downgrades after restart,['bug'],0.14944444444444444
2502,closed,deltanedas,2020-09-06 13:46:38+00:00,2020-09-06 14:05:15+00:00,cannot scroll in research dialog,['bug'],0.31027777777777776
2501,closed,D-player1,2020-09-06 13:33:03+00:00,2020-09-06 13:41:53+00:00,team weapon,['bug'],0.14722222222222223
2500,closed,Prosta4okua,2020-09-06 09:06:55+00:00,2020-09-06 13:07:57+00:00,rotateblock,['bug'],4.017222222222222
2495,closed,mse-k,2020-09-05 18:14:53+00:00,2020-09-05 18:36:08+00:00,why does this label even exist because every issue with it was given to the issue by the person who made it,['a disgrace'],0.3541666666666667
2494,closed,mse-k,2020-09-05 17:55:11+00:00,2020-09-05 18:33:58+00:00,spiders can walk in dark areas,['bug'],0.6463888888888889
2491,closed,D-player1,2020-09-05 13:34:41+00:00,2020-09-05 14:14:58+00:00,bugged block placement,['bug'],0.6713888888888889
2487,closed,D-player1,2020-09-05 09:50:18+00:00,2020-09-05 12:42:23+00:00,player camera,['bug'],2.8680555555555554
2484,closed,younggam,2020-09-05 06:57:54+00:00,2020-09-05 12:41:46+00:00,unit's health doesn't save correctly,['bug'],5.731111111111111
2482,closed,deltanedas,2020-09-03 14:06:21+00:00,2020-09-03 14:43:58+00:00,cat image processor schematic causes lots of lag,['bug'],0.6269444444444444
2480,closed,sk7725,2020-09-03 05:07:35+00:00,2020-09-03 13:56:04+00:00,bloom flickers way too much,['bug'],8.808055555555555
2478,closed,mse-k,2020-09-03 01:09:49+00:00,2020-09-03 14:25:28+00:00,median option in map editor crashes the game,['bug'],13.260833333333334
2477,closed,parkouristik93,2020-09-02 18:35:59+00:00,2020-09-02 18:39:07+00:00,processor's ui overlays,['bug'],0.052222222222222225
2476,closed,imreallybadatnames,2020-09-02 10:48:25+00:00,2020-09-02 17:32:28+00:00,"attempt to update immediately closes and empties the current game jar, not even making a new one.",['bug'],6.734166666666667
2474,closed,ifritdiezel,2020-09-01 14:50:06+00:00,2020-09-01 15:34:14+00:00,offline error screen spam on bleeding edge,['bug'],0.7355555555555555
2473,closed,deltanedas,2020-09-01 06:47:35+00:00,2020-09-01 17:17:18+00:00,desync with player controller turret's @shooting,['bug'],10.495277777777778
2472,closed,deltanedas,2020-09-01 06:24:15+00:00,2020-09-03 19:23:18+00:00,turret controller desync,['bug'],60.98416666666667
2471,closed,TRRESTGHGYTCFTGBCXSZD,2020-08-31 10:02:06+00:00,2020-08-31 12:31:59+00:00,reload wont reload sounds,['bug'],2.4980555555555557
2470,closed,rodrigolitzius,2020-08-31 07:25:23+00:00,2020-08-31 12:32:28+00:00,crash with mods,['bug'],5.118055555555555
2468,closed,ethandudu,2020-08-30 12:42:01+00:00,2020-08-30 13:10:49+00:00,light does'nt blink before death,['bug'],0.48
2467,closed,Quezler,2020-08-30 11:16:50+00:00,2020-08-30 13:20:00+00:00,coreblock ? : doesn't display bar.corereq,['bug'],2.0527777777777776
2466,closed,Quezler,2020-08-30 11:10:10+00:00,2020-09-01 15:34:13+00:00,(basically) all empty fluid blocks show water throughput on hover,['bug'],52.40083333333333
2465,closed,deltanedas,2020-08-30 07:32:57+00:00,2020-08-30 13:14:04+00:00,weird overlap in the top left menu on mobile,['bug'],5.685277777777777
2463,closed,ThePythonGuy3,2020-08-29 19:43:47+00:00,2020-08-30 13:16:58+00:00,"ores ""corrupt"" randomly",['bug'],17.553055555555556
2460,closed,deltanedas,2020-08-29 15:21:40+00:00,2020-08-29 16:18:42+00:00,server crash with logic processors,['bug'],0.9505555555555556
2459,closed,grimsoul7,2020-08-29 14:02:05+00:00,2020-09-01 15:34:13+00:00,red delete line doesnt appear ,['bug'],73.53555555555556
2458,closed,AsterixAi,2020-08-29 12:20:34+00:00,2020-09-01 15:34:13+00:00,tech tree stuck,['bug'],75.2275
2457,closed,ghost,2020-08-29 10:25:40+00:00,2020-08-29 12:18:40+00:00,something about bugs ,['bug'],1.8833333333333333
2456,closed,WeiJian122-afk,2020-08-29 10:11:35+00:00,2020-09-01 15:34:13+00:00,"when the fuse trys to shoot, the game crashes and when i open the save it also crashes",['bug'],77.37722222222222
2455,closed,omgaXD,2020-08-29 08:08:26+00:00,2020-08-31 12:43:57+00:00,unit factories play animation when they don't build,['bug'],52.591944444444444
2454,closed,younggam,2020-08-29 06:04:46+00:00,2020-08-29 12:17:09+00:00,ghost bullets bug,['bug'],6.206388888888889
2453,closed,Gdeft,2020-08-29 03:27:51+00:00,2020-08-30 14:09:10+00:00,some blocks cannot be placed on the border of the map.,['bug'],34.68861111111111
2452,closed,tezlm,2020-08-28 19:18:38+00:00,2020-08-30 14:02:46+00:00,upgrading core resets resource display,['bug'],42.73555555555556
2450,closed,Slotterleet,2020-08-28 18:02:38+00:00,2020-08-29 01:56:27+00:00,modded turret crash oh no,['bug'],7.896944444444444
2449,closed,hadron13,2020-08-28 16:48:48+00:00,2020-09-01 15:34:12+00:00,visual bug with mech related blocks,['bug'],94.75666666666666
2448,closed,Abrifq,2020-08-28 15:27:34+00:00,2020-08-28 19:01:41+00:00,sound sliders never go 0% completely,['bug'],3.568611111111111
2446,closed,DockedSiamang22,2020-08-28 13:57:32+00:00,2020-08-29 02:02:18+00:00,indistructable menders,['bug'],12.079444444444444
2443,closed,rodrigolitzius,2020-08-27 19:47:43+00:00,2020-08-27 19:52:53+00:00,save message,['bug'],0.08611111111111111
2442,closed,vghfr,2020-08-27 18:30:00+00:00,2020-08-27 18:42:50+00:00,community servers tab bug,['bug'],0.21388888888888888
2441,closed,TheMrAlbert,2020-08-27 13:58:34+00:00,2020-08-27 14:12:22+00:00,"players can interact things while ""waiting for players..."" is on middle of the screen in pvp game/server",['bug'],0.23
2440,closed,deltanedas,2020-08-27 13:11:57+00:00,2020-08-27 13:32:01+00:00,player can be votekicked multiple times simultaneously,['bug'],0.33444444444444443
2439,closed,BasedUser,2020-08-27 01:34:05+00:00,2020-08-27 02:01:29+00:00,server doesn't preserve gamemodes,['bug'],0.45666666666666667
2437,closed,VBismuth,2020-08-26 22:13:56+00:00,2020-08-26 22:41:37+00:00,useless scatter turret,['bug'],0.4613888888888889
2436,closed,zabzabzab,2020-08-26 21:27:19+00:00,2020-08-26 22:56:29+00:00,windows,['bug'],1.4861111111111112
2434,closed,rodrigolitzius,2020-08-26 19:29:29+00:00,2020-08-26 20:48:34+00:00,all items that can't be disable with a processor,['bug'],1.3180555555555555
2433,closed,rodrigolitzius,2020-08-26 17:32:53+00:00,2020-08-26 17:57:06+00:00,mass con. and payload router,['bug'],0.4036111111111111
2432,closed,rodrigolitzius,2020-08-26 16:09:03+00:00,2020-08-26 16:16:16+00:00,language change error,['bug'],0.12027777777777778
2431,closed,deltanedas,2020-08-26 16:01:31+00:00,2020-08-26 16:06:20+00:00,speedhack,['bug'],0.08027777777777778
2429,closed,Quezler,2020-08-26 08:18:32+00:00,2020-08-26 13:21:30+00:00,bleeding edge auto updater mac desktop crash,['bug'],5.049444444444444
2427,closed,rodrigolitzius,2020-08-26 04:00:54+00:00,2020-08-26 13:21:30+00:00,item sources can't be disable,['bug'],9.343333333333334
2426,closed,grimsoul7,2020-08-26 03:16:29+00:00,2020-08-26 03:43:51+00:00,arkyid can build a block ,['bug'],0.45611111111111113
2425,closed,rodrigolitzius,2020-08-26 02:58:17+00:00,2020-08-26 03:14:16+00:00,core wrong respawn,['bug'],0.2663888888888889
2424,closed,deltanedas,2020-08-25 21:23:30+00:00,2020-08-25 23:46:21+00:00,logic processor oom,['bug'],2.3808333333333334
2423,closed,rodrigolitzius,2020-08-25 18:56:43+00:00,2020-08-25 19:04:02+00:00,wrong sprites,['bug'],0.12194444444444444
2422,closed,Erisfiregamer1,2020-08-25 17:20:27+00:00,2020-08-25 17:34:35+00:00,oil bomb ending in sandbox.,['bug'],0.23555555555555555
2421,closed,rodrigolitzius,2020-08-25 16:42:24+00:00,2020-08-25 16:55:26+00:00,crash,['bug'],0.21722222222222223
2419,closed,iLagSoUhax,2020-08-25 13:53:09+00:00,2020-08-27 14:17:02+00:00,bridge conveyor graphical glitch,['bug'],48.39805555555556
2417,closed,iLagSoUhax,2020-08-25 13:01:56+00:00,2020-08-25 13:24:55+00:00,issue with bugged panning if using follow mouse,['bug'],0.38305555555555554
2416,closed,Quezler,2020-08-25 11:07:23+00:00,2020-08-25 13:24:55+00:00,logic overlap on the tech tree,['bug'],2.292222222222222
2415,closed,SuperStormer,2020-08-25 08:10:30+00:00,2020-08-25 13:16:14+00:00,command center has no description,['bug'],5.095555555555555
