number,state,contributor,created_at,closed_at,title,labels,resolution_time
4743,closed,ghost,2021-02-20 08:41:28+00:00,2021-02-20 14:36:07+00:00,pog,['bug'],5.910833333333334
4740,closed,jake-87,2021-02-20 05:38:38+00:00,2021-02-20 14:52:25+00:00,gradlew builds and prebuild jars fail on freebsd,['bug'],9.229722222222222
4739,closed,ParraRespuestas,2021-02-20 04:10:30+00:00,2021-02-20 14:36:01+00:00,a crash has occured,['bug'],10.425277777777778
4737,closed,SollyBunny,2021-02-19 22:33:13+00:00,2021-02-19 22:55:48+00:00,linux no sound pulseaudio,['bug'],0.3763888888888889
4733,closed,Sanya2907,2021-02-19 14:16:00+00:00,2021-02-19 14:26:05+00:00,emfile issue on ios ,['bug'],0.16805555555555557
4732,closed,Quezler,2021-02-19 13:13:16+00:00,2021-02-19 14:04:23+00:00,powermodule builds on the edge of node range do not autoconnect,['unlabeled'],0.8519444444444444
4731,closed,violetastcs,2021-02-19 12:11:32+00:00,2021-02-19 14:00:54+00:00,game doesn't run on `musl` libc distros,['bug'],1.8227777777777778
4729,closed,ThibPlume,2021-02-18 21:56:17+00:00,2021-02-18 22:00:29+00:00,heat in unit doesn't return null,['bug'],0.07
4722,closed,movercell,2021-02-18 10:33:46+00:00,2021-02-18 15:01:46+00:00,java or js mods not working,['unlabeled'],4.466666666666667
4721,closed,QmelZ,2021-02-18 08:58:23+00:00,2021-02-18 15:03:53+00:00,game closes at startup,['bug'],6.091666666666667
4720,closed,Kieaer,2021-02-18 08:57:31+00:00,2021-02-18 15:21:37+00:00,server doesn't detect all client mods,['bug'],6.401666666666666
4716,closed,mayli,2021-02-17 21:57:13+00:00,2021-02-17 21:58:10+00:00,health/shield rendered negative value (?) when killed by foreshadow in v125,['bug'],0.015833333333333335
4715,closed,Nester23,2021-02-17 21:05:43+00:00,2021-02-17 22:12:41+00:00,enemy flares fly in circles while trying to attack a building,['bug'],1.116111111111111
4711,closed,Catchears,2021-02-17 11:05:33+00:00,2021-02-17 14:07:04+00:00,strange lines on orange metal tiles on android 11,['bug'],3.0252777777777777
4710,closed,rocboronat,2021-02-17 10:38:46+00:00,2021-02-17 14:10:48+00:00,the logic to know if it's a phone or a tablet isn't reliable,['bug'],3.533888888888889
4709,closed,shugen002,2021-02-17 10:28:52+00:00,2021-02-17 14:09:24+00:00,use say command in console may cause connection disconnect.,['bug'],3.6755555555555555
4707,closed,Endermancat,2021-02-17 09:01:55+00:00,2021-02-17 10:54:10+00:00,blindshoot mouse tracking,['unlabeled'],1.8708333333333333
4706,closed,liuxilu,2021-02-17 07:16:14+00:00,2021-02-17 14:06:48+00:00,logic hints `lenum.xxx` mixed up,['bug'],6.842777777777778
4704,closed,buthed010203,2021-02-17 00:06:36+00:00,2021-02-17 00:23:46+00:00,bullet homing is still weird at high fps,['bug'],0.2861111111111111
4702,closed,LeoSko,2021-02-16 20:05:29+00:00,2021-02-16 20:25:05+00:00,red is not red anymore,['bug'],0.32666666666666666
4701,closed,Catchears,2021-02-16 17:15:58+00:00,2021-02-16 17:20:41+00:00,can't place single power nodes,['bug'],0.07861111111111112
4700,closed,UglyBugly,2021-02-16 15:57:31+00:00,2021-02-16 15:58:42+00:00, .,['unlabeled'],0.01972222222222222
4694,closed,Highfire1,2021-02-16 07:24:56+00:00,2021-02-16 14:13:55+00:00,grass cliff/obstacles flicker when next to conveyor,['bug'],6.816388888888889
4693,closed,Totaly-Not-A-Mole,2021-02-16 03:38:01+00:00,2021-02-16 14:01:05+00:00,game crashes when placing power nodes,['bug'],10.384444444444444
4692,closed,Laggyboi0701,2021-02-16 01:46:38+00:00,2021-02-16 14:00:56+00:00,changing gui problem,['bug'],12.238333333333333
4690,closed,MrFlubber,2021-02-15 23:19:13+00:00,2021-02-15 23:43:49+00:00,invincible guardian in tar fields,['bug'],0.41
4687,closed,Newguy-ish,2021-02-15 19:51:10+00:00,2021-02-15 19:51:51+00:00,sprites-override only changing battery build plan sprite,['bug'],0.01138888888888889
4686,closed,Somka000,2021-02-15 15:48:49+00:00,2021-02-15 15:58:10+00:00,vanishing units,['bug'],0.15583333333333332
4685,closed,Sp3rw3r,2021-02-15 15:21:33+00:00,2021-02-15 15:37:29+00:00,units vanish,['bug'],0.26555555555555554
4684,closed,LixieWulf,2021-02-15 10:34:10+00:00,2021-02-15 14:24:57+00:00,turrets don't update liquids,['bug'],3.846388888888889
4680,closed,Syncinus,2021-02-15 05:33:03+00:00,2021-02-15 14:31:05+00:00,crawler got stuck on a wall,['bug'],8.967222222222222
4679,closed,sebasom2,2021-02-15 00:47:51+00:00,2021-02-15 00:48:49+00:00,"bug with schematics, and processors ",['unlabeled'],0.01611111111111111
4672,closed,shugen002,2021-02-14 04:43:37+00:00,2021-02-14 13:51:12+00:00,too high base damage cause it does not damage.,['bug'],9.126388888888888
4671,closed,Wencelsav,2021-02-14 01:07:47+00:00,2021-02-14 08:07:58+00:00,processor became not controlling units. is this a bug or this is a feature update?,['unlabeled'],7.003055555555555
4670,closed,pawlick228,2021-02-13 19:17:26+00:00,2021-02-13 19:27:10+00:00,bug with shoot,['unlabeled'],0.1622222222222222
4664,closed,baobabbab,2021-02-12 20:58:46+00:00,2021-02-12 21:01:07+00:00,curvature of text in russian translation,['bug'],0.03916666666666667
4659,closed,NiChrosia,2021-02-12 02:45:48+00:00,2021-02-12 13:41:05+00:00,some sprites are smaller than usual when researching technology in the tech tree,['bug'],10.921388888888888
4658,closed,shugen002,2021-02-12 02:33:57+00:00,2021-02-12 13:41:44+00:00,too much core on map will cause client fail to join server.,['bug'],11.129722222222222
4657,closed,way-zer,2021-02-11 16:02:44+00:00,2021-02-11 16:04:41+00:00,invalid powermodule.links after resize in editor,['bug'],0.0325
4653,closed,Newguy-ish,2021-02-10 22:42:06+00:00,2021-02-11 00:02:19+00:00,mod.hjson ignored,['bug'],1.3369444444444445
4651,closed,Quezler,2021-02-10 19:48:59+00:00,2021-02-10 19:54:35+00:00,turrets (not always) targeting multiblocks,['unlabeled'],0.09333333333333334
4645,closed,crides,2021-02-09 18:33:25+00:00,2021-02-09 18:46:23+00:00,steam achievement explorer is not triggered,['bug'],0.21611111111111111
4644,closed,ROBLOX2ENTITY,2021-02-09 18:10:25+00:00,2021-02-09 18:43:43+00:00,naval unit steering problems,['unlabeled'],0.555
4643,closed,LOVECN81,2021-02-09 13:39:31+00:00,2021-02-09 14:28:13+00:00,crash-report,['bug'],0.8116666666666666
4642,closed,Catchears,2021-02-09 09:47:43+00:00,2021-02-09 14:35:11+00:00,"""[e] to enable building"" appears over ""[v] to respawn in core""",['bug'],4.791111111111111
4641,closed,UnionofSovietSocialistRepublics,2021-02-09 07:36:40+00:00,2021-02-09 14:28:46+00:00,armor stat is broken.....,['bug'],6.868333333333333
4639,closed,LixieWulf,2021-02-09 03:38:52+00:00,2021-02-09 14:27:56+00:00,resource requirements are in brazil,['bug'],10.817777777777778
4638,closed,Highfire1,2021-02-08 22:43:16+00:00,2021-02-08 22:54:11+00:00,flare/horizon/others secret buff,['bug'],0.18194444444444444
4632,closed,Stupider666,2021-02-08 19:27:17+00:00,2021-02-08 19:31:52+00:00,sand and sorters,['unlabeled'],0.0763888888888889
4630,closed,buthed010203,2021-02-08 16:18:26+00:00,2021-02-08 16:26:15+00:00,bullets dodge targets instead of hitting them ;-;,['bug'],0.13027777777777777
4627,closed,niguandezhao,2021-02-08 11:25:01+00:00,2021-02-08 12:59:12+00:00,启动错误,['bug'],1.5697222222222222
4625,closed,ROBLOX2ENTITY,2021-02-08 08:07:24+00:00,2021-02-08 08:28:03+00:00,errors since 124,['unlabeled'],0.3441666666666667
4623,closed,RusselPlayz3422,2021-02-08 06:05:12+00:00,2021-02-08 14:46:25+00:00,start screen broken,['bug'],8.686944444444444
4621,closed,driver1748,2021-02-08 02:58:15+00:00,2021-02-08 14:54:39+00:00,errors when lanching v124 in china,['bug'],11.94
4620,closed,sup3r87,2021-02-08 01:50:08+00:00,2021-02-08 14:52:51+00:00,steam version crashing when opening mod folder,['bug'],13.045277777777779
4619,closed,RusselPlayz3422,2021-02-08 01:04:38+00:00,2021-02-08 01:05:14+00:00,start screen is broken,['bug'],0.01
4617,closed,LeoSko,2021-02-07 15:55:35+00:00,2021-02-07 16:11:52+00:00,"core upgrade from server syncs only once, consequent upgrades cause desync",['bug'],0.2713888888888889
4616,closed,LeoSko,2021-02-07 15:14:52+00:00,2021-02-07 15:21:43+00:00,stable desync of unloaders of another teams,['bug'],0.11416666666666667
4614,closed,DjVicthor,2021-02-07 13:50:12+00:00,2021-02-07 14:11:57+00:00,sound error (android),['unlabeled'],0.3625
4611,closed,Kieaer,2021-02-07 09:53:58+00:00,2021-02-07 14:14:02+00:00,physicsprocess npe,['bug'],4.334444444444444
4605,closed,LeoSko,2021-02-06 16:33:38+00:00,2021-02-06 16:38:10+00:00,leg pathfinding breaks if solid unbreakable is above space floor,['bug'],0.07555555555555556
4604,closed,sans11leon,2021-02-06 14:04:35+00:00,2021-02-06 14:06:13+00:00,"hola, últimamente estuve jugando mindustry en pc y me di cuenta que cada vez que cerraba el juego todo el progreso se perdía, intente guardar el avance en una carpeta pero me da error, ayuda",['unlabeled'],0.02722222222222222
4601,closed,dan-1am,2021-02-06 11:32:47+00:00,2021-02-06 13:54:06+00:00,logic bug: some cpu's restart after sector reload (updated),['unlabeled'],2.355277777777778
4599,closed,Quezler,2021-02-06 09:29:39+00:00,2021-02-06 13:44:03+00:00,:android project not found in gradle,['unlabeled'],4.24
4598,closed,a54008808,2021-02-06 05:22:43+00:00,2021-02-06 13:53:47+00:00,windows10 pro 64,['unlabeled'],8.517777777777777
4597,closed,MrBacon470,2021-02-06 00:16:58+00:00,2021-02-06 04:21:33+00:00,macos in game fps stuttering,['bug'],4.076388888888889
4596,closed,RouterChainsSuckk,2021-02-05 23:04:07+00:00,2021-02-06 13:53:31+00:00,core database flickering (repost),['bug'],14.823333333333334
4593,closed,Catchears,2021-02-05 10:17:27+00:00,2021-02-05 10:25:09+00:00,strange visual bugs in map editor,['bug'],0.12833333333333333
4592,closed,aushafer06,2021-02-05 06:39:46+00:00,2021-02-05 14:37:52+00:00,t4 reconstructor rejecting t3 unit,['unlabeled'],7.968333333333334
4591,closed,dan-1am,2021-02-04 21:56:00+00:00,2021-02-04 23:19:10+00:00,logic bug: some cpu's restart after sector reload,['unlabeled'],1.386111111111111
4587,closed,ROBLOX2ENTITY,2021-02-04 17:18:03+00:00,2021-02-04 17:31:50+00:00,community server list errors,['unlabeled'],0.22972222222222222
4585,closed,CSknight0389,2021-02-04 05:51:55+00:00,2021-02-04 14:18:10+00:00,mindustry stuck at loading than it not responding,['bug'],8.4375
4584,closed,Nester23,2021-02-04 05:38:03+00:00,2021-02-04 14:26:09+00:00,rounding when building with logic,['bug'],8.801666666666666
4524,closed,Absolute359,2021-02-03 18:10:19+00:00,2021-02-03 18:38:46+00:00,tsunami liquid storage,['bug'],0.4741666666666667
4510,closed,STAPLER0,2021-02-03 14:22:39+00:00,2021-02-03 14:49:23+00:00,landing in the location of mushroom pass,['unlabeled'],0.44555555555555554
4509,closed,STAPLER0,2021-02-03 09:35:57+00:00,2021-02-03 13:47:50+00:00,landing in the location of mushroom pass,['unlabeled'],4.198055555555555
4508,closed,LixieWulf,2021-02-03 02:42:32+00:00,2021-02-03 14:03:55+00:00,minimap unit icon drawing,['bug'],11.356388888888889
4507,closed,itday,2021-02-03 02:36:03+00:00,2021-02-03 14:03:46+00:00,power transfer with diodes doesn't work as expected,['bug'],11.461944444444445
4506,closed,itday,2021-02-03 01:51:04+00:00,2021-02-03 02:44:21+00:00,power pole connections aren't saved in blueprints ,['bug'],0.8880555555555556
4505,closed,itday,2021-02-03 01:37:26+00:00,2021-02-03 03:51:36+00:00,inverted sorters doesn't work as expected,['bug'],2.236111111111111
4500,closed,antonilol,2021-02-02 16:29:24+00:00,2021-02-02 17:27:25+00:00,bugged map editor,['bug'],0.9669444444444445
4496,closed,11musah,2021-02-02 02:01:32+00:00,2021-02-02 02:01:44+00:00,anane,['bug'],0.0033333333333333335
4495,closed,Nanosuitwitdaboomboxwhatsongwillhepla,2021-02-01 23:04:44+00:00,2021-02-01 23:08:39+00:00,about to lose two days worth of progress,['bug'],0.06527777777777778
4493,closed,Quezler,2021-02-01 13:07:15+00:00,2021-02-01 14:24:48+00:00,health of constructed blocks being too low,['unlabeled'],1.2925
4492,closed,Wencelsav,2021-02-01 07:39:54+00:00,2021-02-01 14:24:49+00:00,error connected with mono,['unlabeled'],6.748611111111111
4491,closed,Irt6282,2021-02-01 07:33:05+00:00,2021-02-01 14:21:47+00:00,anuken,['bug'],6.8116666666666665
4490,closed,Kiinae,2021-02-01 04:29:12+00:00,2021-02-01 14:24:49+00:00,material_ steam achievements unobtainable for older players without restarting progress,['bug'],9.926944444444445
4486,closed,RouterChainsSuckk,2021-01-31 22:18:14+00:00,2021-01-31 23:16:35+00:00,coredatbase flikering,['bug'],0.9725
4483,closed,valtsu41,2021-01-31 18:34:17+00:00,2021-01-31 20:51:52+00:00,generation filter choices not on screen,['bug'],2.2930555555555556
4482,closed,PolloUsami,2021-01-31 17:41:50+00:00,2021-01-31 20:45:15+00:00,link with processors not overwrite,['bug'],3.0569444444444445
4476,closed,Quezler,2021-01-30 16:56:29+00:00,2021-01-31 20:51:52+00:00,oct has range in the core database,['unlabeled'],27.923055555555557
4475,closed,souvikpodder,2021-01-30 11:13:53+00:00,2021-01-31 20:51:52+00:00,launching with custom core in campaign crashes the game.,['bug'],33.63305555555556
4474,closed,movercell,2021-01-30 08:29:05+00:00,2021-01-31 20:51:52+00:00,не игровой альфа,['unlabeled'],36.37972222222222
4471,closed,LOVECN81,2021-01-30 03:39:10+00:00,2021-01-30 04:02:27+00:00,bug report,['bug'],0.38805555555555554
4470,closed,LOVECN81,2021-01-30 03:34:49+00:00,2021-01-30 04:02:14+00:00,bug_report,['unlabeled'],0.45694444444444443
4468,closed,Bluemeh,2021-01-29 20:20:45+00:00,2021-01-29 20:23:59+00:00,mindustry crashes ,['bug'],0.05388888888888889
4466,closed,JanStruan,2021-01-29 15:51:17+00:00,2021-01-29 15:55:32+00:00,"unloader, plastanium ",['bug'],0.07083333333333333
4463,closed,Quezler,2021-01-29 09:31:42+00:00,2021-01-29 14:32:40+00:00,recent power graph changes fail build tests,['unlabeled'],5.016111111111111
4461,closed,Quezler,2021-01-28 14:44:02+00:00,2021-01-28 15:23:15+00:00,lag when placing large solar panels over smaller ones,['unlabeled'],0.6536111111111111
4460,closed,TheGamer1002,2021-01-28 14:11:09+00:00,2021-01-28 14:18:03+00:00,mindustry crashes while loading sounds,['bug'],0.115
4459,closed,deltanedas,2021-01-28 12:23:02+00:00,2021-01-28 14:17:32+00:00,core.net is accessible by scripts,['bug'],1.9083333333333334
4456,closed,Waffz,2021-01-28 03:34:15+00:00,2021-01-28 14:03:45+00:00,"fresh install of game, crashes while in loading screen",['unlabeled'],10.491666666666667
4454,closed,buthed010203,2021-01-27 18:12:20+00:00,2021-01-27 18:14:11+00:00,inconsistent lines,['bug'],0.030833333333333334
4453,closed,JiroCab,2021-01-27 14:54:30+00:00,2021-01-27 16:49:17+00:00,you need pin point accuracy when removing a line in logic,['bug'],1.9130555555555555
4450,closed,Quezler,2021-01-27 14:09:29+00:00,2021-01-27 16:49:17+00:00,fx.unitspawn nullpointer,['unlabeled'],2.6633333333333336
4448,closed,LixieWulf,2021-01-27 05:48:23+00:00,2021-01-27 16:48:10+00:00,modded units in waves not saving,['bug'],10.99638888888889
4445,closed,Nanosuitwitdaboomboxwhatsongwillhepla,2021-01-27 00:12:35+00:00,2021-01-27 00:25:06+00:00,save file problem,['bug'],0.2086111111111111
4443,closed,YhuanDebeste,2021-01-26 11:24:56+00:00,2021-01-26 15:37:08+00:00,wave skipping and disappearing enemies,['unlabeled'],4.203333333333333
4436,closed,Sp3rw3r,2021-01-25 12:34:19+00:00,2021-01-25 14:59:31+00:00,getblock type does not return comparable type with stone-walls,['bug'],2.42
4431,closed,Quezler,2021-01-24 18:06:10+00:00,2021-01-24 18:08:09+00:00,incompatible mods kick triggers kick cooldown,['unlabeled'],0.03305555555555555
4430,closed,redwarp,2021-01-24 14:43:38+00:00,2021-01-24 16:09:15+00:00,cloud saves are not cross-platform,['unlabeled'],1.4269444444444443
4424,closed,Matthew-McRaven,2021-01-24 00:50:48+00:00,2021-01-24 01:17:10+00:00,crash on load on mac os 11.1,['bug'],0.43944444444444447
4422,closed,LixieWulf,2021-01-23 14:11:18+00:00,2021-01-23 15:08:32+00:00,double-check your json adapters,['bug'],0.9538888888888889
4421,closed,benji78,2021-01-23 11:21:24+00:00,2021-01-23 15:09:18+00:00,corrupted campaign sectors (previously oppened in release 123.1) after opening release 122.1 by mistake,['unlabeled'],3.7983333333333333
4420,closed,sk7725,2021-01-23 11:20:18+00:00,2021-01-23 15:33:14+00:00,statuseffect speedmultipliern't,['bug'],4.2155555555555555
4418,closed,LeoSko,2021-01-23 09:21:23+00:00,2021-01-23 15:33:14+00:00,conveyors pathfinding doesn't place junctions if crossed by 1 tile,['bug'],6.1975
4416,closed,LeoSko,2021-01-23 08:46:57+00:00,2021-01-23 15:33:14+00:00,crawlers don't explode next to core,['bug'],6.771388888888889
4415,closed,ImBadAtMakingNames,2021-01-23 06:50:17+00:00,2021-01-23 15:17:38+00:00,wave not spawning after frame-perfect(?) sector exit,['bug'],8.455833333333333
4410,closed,Slava0135,2021-01-22 09:21:45+00:00,2021-01-22 15:01:49+00:00,crash on server while using payload,['bug'],5.667777777777777
4408,closed,Volas171,2021-01-22 03:32:12+00:00,2021-01-22 03:40:52+00:00,mindustry android doesn't load classes.dex on jar,['bug'],0.14444444444444443
4407,closed,TRRESTGHGYTCFTGBCXSZD,2021-01-22 02:06:02+00:00,2021-01-22 02:21:10+00:00,"putting # anywhere on draw string become ""frog""",['bug'],0.25222222222222224
4406,closed,Khanx,2021-01-21 22:05:20+00:00,2021-01-21 23:48:45+00:00,workshop's schematics are not available offline,['bug'],1.7236111111111112
4405,closed,buthed010203,2021-01-21 21:23:49+00:00,2021-01-21 21:36:08+00:00,logic max string length causes issues with mods,['bug'],0.20527777777777778
4404,closed,Quezler,2021-01-21 20:03:34+00:00,2021-01-21 20:03:37+00:00,autotiler blocks don't render out of bounds,['unlabeled'],0.0008333333333333334
4403,closed,Quezler,2021-01-21 19:50:56+00:00,2021-01-21 21:10:23+00:00,cultivator uses power while requirements aren't met,['unlabeled'],1.3241666666666667
4402,closed,Quezler,2021-01-21 19:30:16+00:00,2021-01-21 19:45:57+00:00,rotated schematics render no power wires,['unlabeled'],0.2613888888888889
4398,closed,abomb4,2021-01-21 12:13:45+00:00,2021-01-21 13:48:47+00:00,turrets actual fire speed is slower than displayed,['bug'],1.583888888888889
4396,closed,RebornTrack970,2021-01-21 09:28:46+00:00,2021-01-21 13:49:58+00:00,cant connect to same server if using the same wifi,['bug'],4.3533333333333335
4395,closed,linglan512572354,2021-01-21 07:40:59+00:00,2021-01-21 13:47:29+00:00,unithealthmultiplier didn`t take effect,['bug'],6.108333333333333
4393,closed,rdragonrydr,2021-01-21 04:33:01+00:00,2021-01-21 13:48:46+00:00,power reading mismatch,['bug'],9.2625
4390,closed,rodrigolitzius,2021-01-21 01:26:31+00:00,2021-01-21 01:33:54+00:00,power nodes,['bug'],0.12305555555555556
4387,closed,powerneek,2021-01-20 14:16:18+00:00,2021-01-20 14:19:17+00:00,broken campaign,['bug'],0.04972222222222222
4385,closed,Slava0135,2021-01-20 10:53:47+00:00,2021-01-20 14:11:42+00:00,explosion damage is being applied twice on collision,['bug'],3.298611111111111
4381,closed,Jornker,2021-01-19 22:48:38+00:00,2021-01-19 22:59:51+00:00,map upload to steam workshop not working ,['unlabeled'],0.18694444444444444
4380,closed,CaeciliusInHorto,2021-01-19 18:09:59+00:00,2021-01-19 18:30:06+00:00,efficiency information inconsistency,['unlabeled'],0.3352777777777778
4376,closed,RebornTrack970,2021-01-19 07:10:26+00:00,2021-01-19 14:58:50+00:00,overflow gate crashing the game.,['bug'],7.806666666666667
4369,closed,DJ2638,2021-01-18 16:48:22+00:00,2021-01-18 22:19:01+00:00,game audio doesn’t play through phone speakers,['unlabeled'],5.510833333333333
4368,closed,antonilol,2021-01-18 16:40:01+00:00,2021-01-18 22:23:26+00:00,meltdown thinks he has water when no power is supplied,['bug'],5.723611111111111
4367,closed,antonilol,2021-01-18 16:03:12+00:00,2021-01-18 22:20:19+00:00,bleeding edge update progress bar doesnt show up under 6 mb,['bug'],6.285277777777778
4366,closed,antonilol,2021-01-18 13:03:36+00:00,2021-01-18 22:17:44+00:00,distributor limited,['bug'],9.235555555555555
4364,closed,eric15342335,2021-01-18 10:02:21+00:00,2021-01-18 22:17:17+00:00,game crashed c++ runtime library assertion failed,['bug'],12.248888888888889
4362,closed,PrinceofhellAzazel,2021-01-18 03:25:01+00:00,2021-01-18 22:17:10+00:00,naval unit path finding ,['bug'],18.86916666666667
4361,closed,sk7725,2021-01-18 01:53:38+00:00,2021-01-18 22:16:59+00:00,payload.write is not public static in android,['bug'],20.389166666666668
4360,closed,buthed010203,2021-01-17 16:43:48+00:00,2021-01-17 20:20:46+00:00,borderless windowed cuts off 7 pixels on every edge of the screen,['bug'],3.616111111111111
4359,closed,rmuchan,2021-01-17 14:55:37+00:00,2021-01-17 20:20:15+00:00,chained overflow gates not working,['bug'],5.410555555555556
4357,closed,Quezler,2021-01-17 11:29:28+00:00,2021-01-17 20:31:39+00:00,core incineration visuals fail on multiplayer,['unlabeled'],9.036388888888888
4351,closed,ghost,2021-01-16 22:49:54+00:00,2021-01-17 20:29:29+00:00,doors cannot be toggled if attached to a door that will be built,['bug'],21.65972222222222
4349,closed,LixieWulf,2021-01-16 20:14:55+00:00,2021-01-17 20:31:39+00:00,sappers don't render when ai or autotarget is used to fire,['bug'],24.27888888888889
4345,closed,BlueCapacitor,2021-01-16 14:40:12+00:00,2021-01-17 20:31:39+00:00,"""disabled"" launchpads do not use any power but function properly",['bug'],29.8575
4343,closed,XEN0PHIL,2021-01-16 13:14:30+00:00,2021-01-17 20:31:40+00:00,bridges don't remember their connections when using a scheme/copy,['bug'],31.28611111111111
4340,closed,Halfeclipse,2021-01-16 02:57:44+00:00,2021-01-17 20:17:01+00:00,multiple liquid routers/bridge conduits in series can significantly reduce line throughput ,['bug'],41.32138888888889
4339,closed,rodrigolitzius,2021-01-16 02:20:28+00:00,2021-01-17 20:16:03+00:00,sector lost after crash,['bug'],41.92638888888889
4337,closed,buthed010203,2021-01-15 20:53:09+00:00,2021-01-15 22:09:32+00:00,workshop maps share a common high score,['bug'],1.2730555555555556
4336,closed,ghost,2021-01-15 20:46:20+00:00,2021-01-15 22:09:32+00:00,core upgrades not working with build cost,['bug'],1.3866666666666667
4335,closed,antonilol,2021-01-15 17:07:59+00:00,2021-01-15 17:38:50+00:00,10 of each items on a roomba conveyor,['bug'],0.5141666666666667
4334,closed,Quezler,2021-01-15 12:26:57+00:00,2021-01-15 15:05:09+00:00,sorter cross doesn't render for schematics,['unlabeled'],2.6366666666666667
4331,closed,Soham-maiti,2021-01-15 09:41:26+00:00,2021-01-15 15:01:10+00:00,game does not save state sometimes,['bug'],5.328888888888889
4330,closed,Mangahfold,2021-01-15 09:37:05+00:00,2021-01-15 15:01:30+00:00,megas cannot heal unfinished buildings,['bug'],5.406944444444444
4329,closed,LixieWulf,2021-01-15 06:21:14+00:00,2021-01-15 15:06:03+00:00,navals dont like velocity based things,['bug'],8.746944444444445
4328,closed,guncatt,2021-01-15 00:00:57+00:00,2021-01-15 00:04:58+00:00,liquid tank bug?,['bug'],0.06694444444444445
4325,closed,ghost,2021-01-14 12:39:22+00:00,2021-01-14 16:26:24+00:00,mass driver pointing wrong direction / foreshadow ray not rendering offscreen ,['bug'],3.783888888888889
4323,closed,Domaman202,2021-01-14 10:09:27+00:00,2021-01-14 11:29:12+00:00,crash,['bug'],1.3291666666666666
4321,closed,whio,2021-01-13 23:12:35+00:00,2021-01-13 23:31:29+00:00,importing game data fails to replace save.,['bug'],0.315
4320,closed,gamma-02,2021-01-13 18:42:51+00:00,2021-01-13 18:44:41+00:00,extra/new planet crashes when i launch to a generated sector,['bug'],0.030555555555555555
4319,closed,antonilol,2021-01-13 15:34:54+00:00,2021-01-13 15:43:17+00:00,visual core launching bug,['bug'],0.13972222222222222
4318,closed,Nanosuitwitdaboomboxwhatsongwillhepla,2021-01-13 12:58:55+00:00,2021-01-13 14:42:34+00:00,losing progress from repetitive save file corruption,['bug'],1.7275
4316,closed,Mindustry-Bug-Temp,2021-01-12 21:32:59+00:00,2021-01-12 21:43:57+00:00,triangle draw issue: negative coordinates -> max value,['bug'],0.1827777777777778
4311,closed,hahaslav,2021-01-11 20:47:54+00:00,2021-01-11 21:08:01+00:00,payload info dissapears,['unlabeled'],0.3352777777777778
4309,closed,Slava0135,2021-01-11 08:36:06+00:00,2021-01-11 15:11:41+00:00,parallax ray is not visible if the turret is out of screen,['bug'],6.593055555555556
4306,closed,Matias123321,2021-01-11 04:25:15+00:00,2021-01-11 15:02:13+00:00,random errors at online servers.,['bug'],10.616111111111111
4305,closed,CaeciliusInHorto,2021-01-11 02:04:58+00:00,2021-01-11 15:11:41+00:00,bridge render issue,['unlabeled'],13.111944444444445
4304,closed,Nikolay-Sitnikov,2021-01-10 19:40:48+00:00,2021-01-10 20:20:36+00:00,"unit locate doesn't output on outx, outy, and found if located a building.",['bug'],0.6633333333333333
4301,closed,joshuaptfan,2021-01-10 18:45:39+00:00,2021-01-10 20:23:24+00:00,uradar range is limited to range of unit's first weapon,['bug'],1.6291666666666667
4300,closed,Khanaaan,2021-01-10 17:58:13+00:00,2021-01-10 20:21:04+00:00,found a typo,['unlabeled'],2.3808333333333334
4297,closed,juliand665,2021-01-10 04:54:46+00:00,2021-01-10 05:18:33+00:00,nearby enemy base count not taken into consideration correctly for invasion probability,['unlabeled'],0.3963888888888889
4296,closed,Void-Syrex,2021-01-09 21:11:37+00:00,2021-01-09 21:12:27+00:00,crash report,['bug'],0.013888888888888888
4295,closed,Quezler,2021-01-09 21:10:14+00:00,2021-01-09 21:11:27+00:00,dying air units instantly go under the shadow layer,['unlabeled'],0.020277777777777777
4294,closed,claw4oo,2021-01-09 20:19:31+00:00,2021-01-09 20:43:31+00:00,all crawlers explode at once under player control,['bug'],0.4
4293,closed,Nester23,2021-01-09 17:53:22+00:00,2021-01-09 17:56:52+00:00,a couple of logic issues when reloading the map.,['bug'],0.058333333333333334
4291,closed,itday,2021-01-09 07:55:20+00:00,2021-01-09 15:12:28+00:00,"unit ""mega"" can't be used to heal buildings with a logic unit",['bug'],7.285555555555556
4289,closed,MEEPofFaith,2021-01-09 01:21:15+00:00,2021-01-09 01:26:20+00:00,bullets only perform splash damage on despawn,['bug'],0.08472222222222223
