number,state,contributor,created_at,closed_at,title,labels,resolution_time
7525,closed,Eschatologue,2022-09-07 07:42:53+00:00,2022-09-07 12:56:55+00:00,`under` does not work as intended for unit weapons `regionpart`,['bug'],5.233888888888889
7517,closed,NIK3O3,2022-09-05 06:50:10+00:00,2022-09-05 13:06:13+00:00,crash when destroying structures ,['unlabeled'],6.2675
7509,closed,skipydog,2022-09-03 06:37:49+00:00,2022-09-03 11:48:35+00:00,world processor gets health data from get block incorrectly,['bug'],5.179444444444444
7508,closed,Kieaer,2022-09-03 05:53:54+00:00,2022-09-03 11:46:25+00:00,overlapping buttons when copy mode enabled,['bug'],5.875277777777778
7507,closed,TonkyBoi,2022-09-03 05:05:07+00:00,2022-09-03 11:55:18+00:00,movement speed boost while upgrading conveyors,['bug'],6.836388888888889
7506,closed,Thai3101,2022-09-03 04:12:56+00:00,2022-09-03 11:44:57+00:00,"mindustry stand in the game when breaking a few or more blocks at the same time i feel very uncomfortable because this error makes me have to exit the game and re-enter the game many times, hope you fix it quickly!",['bug'],7.533611111111111
7505,closed,Thai3101,2022-09-03 04:09:24+00:00,2022-09-03 04:10:51+00:00,"mindustry is stuck in the game when breaking a few or more blocks at the same time i feel very uncomfortable because this error makes me have to exit the game and re-enter the game many times, hope you fix it quickly!",['bug'],0.024166666666666666
7503,closed,TyTxexebe,2022-09-02 18:11:14+00:00,2022-09-02 18:21:33+00:00,bug about conduit.,['bug'],0.17194444444444446
7502,closed,ilya034,2022-09-02 16:59:35+00:00,2022-09-02 17:46:44+00:00,"2 buttons ""enable console"" ",['bug'],0.7858333333333334
7501,closed,BasedUser,2022-09-02 08:49:57+00:00,2022-09-02 12:58:04+00:00,drills with a dominantitem of null don't output items,['bug'],4.135277777777778
7498,closed,Ramiels,2022-09-01 20:02:16+00:00,2022-09-01 20:49:04+00:00,failed to load world data on steam multiplayer,['bug'],0.78
7495,closed,BasedUser,2022-09-01 05:35:04+00:00,2022-09-01 12:46:47+00:00,impossible to set overlay via logic to air,['bug'],7.195277777777778
7490,closed,darwin1501,2022-08-31 12:28:20+00:00,2022-08-31 12:31:59+00:00,frequent game crash / freeze ,['unlabeled'],0.060833333333333336
7488,closed,noobexeiii,2022-08-31 09:37:18+00:00,2022-08-31 11:55:17+00:00,version 138 on mac doesnt run,['unlabeled'],2.299722222222222
7486,closed,ghost,2022-08-31 03:56:48+00:00,2022-08-31 11:55:48+00:00,screenshotting with shift+windows+s doesn't take the present frame ,['bug'],7.983333333333333
7485,closed,throwitthefuckaway,2022-08-31 01:35:21+00:00,2022-08-31 01:38:15+00:00,(softlock) alpha 138,['bug'],0.04833333333333333
7484,closed,Funny132,2022-08-30 23:02:28+00:00,2022-08-31 01:17:52+00:00,pathfinding issues,['bug'],2.256666666666667
7479,closed,theperspectiv,2022-08-30 05:21:41+00:00,2022-08-30 10:41:53+00:00,"campaign sectors from previous save are unlocked and shown as ""under attack"" after wiping save data on a different computer",['bug'],5.336666666666667
7477,closed,youmukonpaku1337,2022-08-29 22:47:14+00:00,2022-08-29 22:57:33+00:00,sand boulders spawning accross map,['bug'],0.17194444444444446
7472,closed,arin-prashar,2022-08-29 06:42:34+00:00,2022-08-29 12:58:10+00:00,unable to build in mindustry ,['bug'],6.26
7469,closed,Dat-Guy,2022-08-28 17:44:25+00:00,2022-08-28 20:08:20+00:00,scatche missles collide with air units but do not damage them,['bug'],2.3986111111111112
7468,closed,Erisfiregamer1,2022-08-28 13:35:09+00:00,2022-08-28 13:37:15+00:00,mindustry refuses to provide a crash log.... ever,['bug'],0.035
7465,closed,Nunting,2022-08-28 10:11:42+00:00,2022-08-28 12:17:20+00:00,playtest in editor,['bug'],2.093888888888889
7459,closed,Gerdathlete,2022-08-27 06:34:00+00:00,2022-08-27 06:35:47+00:00,ignore/delete this issue,['bug'],0.029722222222222223
7458,closed,Kieaer,2022-08-26 22:08:44+00:00,2022-08-26 22:09:19+00:00,jitpack says it's repository source code is 1.78gb,['bug'],0.009722222222222222
7457,closed,PTALTS-LK,2022-08-26 17:29:49+00:00,2022-08-26 17:30:11+00:00,"aegires will attack evoke, incite, emanate without payload",['bug'],0.006111111111111111
7452,closed,fede0009000,2022-08-26 13:16:39+00:00,2022-08-26 14:05:32+00:00,game doesn't show loading screen and instantly shows an unloaded menu,['bug'],0.8147222222222222
7444,closed,superdinmc,2022-08-25 13:45:37+00:00,2022-08-25 14:46:18+00:00,game crashes after 2 minutes in main menu,['bug'],1.011388888888889
7441,closed,Hexrotor,2022-08-25 04:15:14+00:00,2022-08-25 04:49:20+00:00,conveyor's animation won't refresh after reopen the map,['bug'],0.5683333333333334
7438,closed,LixieWulf,2022-08-24 14:22:57+00:00,2022-08-24 14:28:02+00:00,thorium reactors dont explode if destroyed,['bug'],0.08472222222222223
7435,closed,agergo100,2022-08-23 18:10:31+00:00,2022-08-23 23:48:36+00:00,server features is missing,['unlabeled'],5.634722222222222
7420,closed,Gerdathlete,2022-08-23 01:10:43+00:00,2022-08-23 02:07:44+00:00,"using ""check for updates"" causes last frame to be continuously drawn above all",['bug'],0.9502777777777778
7419,closed,ral12543,2022-08-22 20:47:06+00:00,2022-08-22 23:26:38+00:00,shield texture,['bug'],2.658888888888889
7417,closed,JniTrRny,2022-08-22 18:18:49+00:00,2022-08-22 18:39:18+00:00,mysterious error case when trying to open maps with objective,['bug'],0.3413888888888889
7412,closed,superdinmc,2022-08-22 13:21:53+00:00,2022-08-22 14:53:51+00:00,game crashes in main menu with nosuchfielderror,['bug'],1.5327777777777778
7404,closed,NWJ9PB,2022-08-20 09:50:04+00:00,2022-08-20 14:35:59+00:00,vsync issue [linux],['bug'],4.7652777777777775
7403,closed,Highfire1,2022-08-20 07:59:35+00:00,2022-08-20 15:54:59+00:00,logic debugger types don't change,['bug'],7.923333333333333
7402,closed,IFRFSX,2022-08-20 04:29:52+00:00,2022-08-20 14:36:27+00:00,bugs in the queue system(v137),['bug'],10.109722222222222
7401,closed,Vect0r0,2022-08-19 22:19:25+00:00,2022-08-20 00:08:17+00:00,map area rule used on a world processor turn on all switches in the map,['bug'],1.8144444444444445
7400,closed,AnVation,2022-08-19 20:39:37+00:00,2022-08-19 20:50:46+00:00,server sync,['bug'],0.18583333333333332
7399,closed,RealWetter,2022-08-19 19:13:30+00:00,2022-08-19 20:50:38+00:00,multiplayer reset,['unlabeled'],1.6188888888888888
7397,closed,RealWetter,2022-08-19 18:48:23+00:00,2022-08-19 18:57:04+00:00,multiplayer reset,['unlabeled'],0.14472222222222222
7396,closed,Infinity-Energy,2022-08-19 10:47:14+00:00,2022-08-19 11:30:07+00:00,missles from disrupt can be detected by turrets,['bug'],0.7147222222222223
7395,closed,Highfire1,2022-08-19 10:03:24+00:00,2022-08-19 11:30:22+00:00,disabled blocks are disabled....permanently!,['bug'],1.4494444444444445
7394,closed,Dawn-Xu-helloworld,2022-08-19 07:02:48+00:00,2022-08-19 11:30:27+00:00,crash in remote server gaming,['unlabeled'],4.460833333333333
7393,closed,overdramaticpanromantic,2022-08-18 19:22:53+00:00,2022-08-19 03:06:40+00:00,sublimates do not attack beam nodes,['bug'],7.729722222222223
7390,closed,Highfire1,2022-08-18 14:33:45+00:00,2022-08-18 16:26:03+00:00,disabled water extractor eats power,['bug'],1.8716666666666666
7389,closed,Highfire1,2022-08-18 12:19:15+00:00,2022-08-18 16:51:02+00:00,itemtake (singular) doesn't work :(,['bug'],4.529722222222222
7388,closed,xicscon,2022-08-18 10:34:54+00:00,2022-08-18 16:26:47+00:00,0fps bug,['bug'],5.864722222222222
7382,closed,RealHifumi,2022-08-17 14:32:20+00:00,2022-08-17 14:34:45+00:00,logic processors allow units to build blocks even if they are not currently researched in campaign,['bug'],0.04027777777777778
7379,closed,ManuWar73,2022-08-16 14:36:11+00:00,2022-08-16 15:25:09+00:00,linear filtering auto-disable,['unlabeled'],0.8161111111111111
7374,closed,babazga,2022-08-15 20:50:35+00:00,2022-08-15 21:11:36+00:00,help me pls,['bug'],0.3502777777777778
7373,closed,NovaAndrom3da,2022-08-15 20:18:33+00:00,2022-08-15 21:11:24+00:00,can't load saves after updating mindustry,['bug'],0.8808333333333334
7363,closed,Banyc,2022-08-14 14:13:15+00:00,2022-08-14 14:41:45+00:00,"binding keys ignore ""mouse back"" inputs on macos","['bug', 'wontfix']",0.475
7362,closed,whywhywhy821,2022-08-14 10:31:41+00:00,2022-08-14 10:48:02+00:00,crash while loading (couldn't load dependencies of asset: sprites/sprites.png),['bug'],0.2725
7359,closed,theosherman,2022-08-13 23:49:03+00:00,2022-08-14 01:00:19+00:00,game crash (null pointer exception) when launching to impact 078,['bug'],1.1877777777777778
7358,closed,FateMaga3,2022-08-13 23:09:37+00:00,2022-08-13 23:10:39+00:00,bug on the enemy base,['bug'],0.017222222222222222
7357,closed,24110802,2022-08-13 20:33:42+00:00,2022-08-13 21:24:28+00:00,unitcount counts player as 2 units when returning to core,['bug'],0.8461111111111111
7352,closed,Bafalutinm,2022-08-12 16:46:29+00:00,2022-08-13 01:24:06+00:00,v7 kep crash help,['unlabeled'],8.626944444444444
7344,closed,RealYeet,2022-08-10 20:19:29+00:00,2022-08-10 23:04:44+00:00,coal and titanium not social distancing properly,['bug'],2.754166666666667
7336,closed,AESIR-Foopy,2022-08-10 00:36:19+00:00,2022-08-10 02:49:33+00:00,strange item void & conveyor interaction,['bug'],2.2205555555555554
7335,closed,LordDoge,2022-08-09 23:52:06+00:00,2022-08-10 00:06:28+00:00,unable to import from github,['bug'],0.23944444444444443
7334,closed,Trepcilonk,2022-08-09 23:44:36+00:00,2022-08-10 00:06:58+00:00,something like a crash,['unlabeled'],0.37277777777777776
7331,closed,Yo0o0o,2022-08-09 11:29:44+00:00,2022-08-09 13:11:20+00:00,"info button not available in tech tree, unless opened through main ui first.",['bug'],1.6933333333333334
7328,closed,Jackson11500,2022-08-08 17:38:21+00:00,2022-08-08 18:24:31+00:00,heat increase liquid conversion rate,['bug'],0.7694444444444445
7327,closed,Jackson11500,2022-08-08 17:20:11+00:00,2022-08-08 18:05:06+00:00,logic spawnwave in server would make ghost units locally,['bug'],0.7486111111111111
7324,closed,way-zer,2022-08-08 06:03:32+00:00,2022-08-08 11:44:49+00:00,can't bootstrap after be auto update.,['bug'],5.688055555555556
7323,closed,nuemu1005,2022-08-08 02:13:15+00:00,2022-08-08 02:40:23+00:00,error,['unlabeled'],0.45222222222222225
7322,closed,nuemu1005,2022-08-08 02:11:10+00:00,2022-08-08 02:40:20+00:00,"i'm trying to enter the mindustry.ddns.net server in mindstry, but i can't because of an error",['unlabeled'],0.4861111111111111
7321,closed,squi2rel,2022-08-08 00:02:39+00:00,2022-08-08 01:37:35+00:00,not router,['bug'],1.5822222222222222
7316,closed,xlPekkalx,2022-08-07 15:11:23+00:00,2022-08-07 17:00:03+00:00,bug with exporting saves,['unlabeled'],1.8111111111111111
7315,closed,NIK3O3,2022-08-06 10:33:13+00:00,2022-08-06 17:20:39+00:00,where is efficiency?,['bug'],6.790555555555556
7310,closed,squi2rel,2022-08-06 04:40:42+00:00,2022-08-06 17:30:55+00:00,units can carry items without cooling time,['bug'],12.836944444444445
7309,closed,Jackson11500,2022-08-06 03:38:41+00:00,2022-08-06 04:12:39+00:00,liquid blocks inconsistent block unit,['bug'],0.5661111111111111
7308,closed,jweather,2022-08-06 03:31:22+00:00,2022-08-06 04:10:12+00:00,elecom mouse button remapping does not function in menu or gameplay,['unlabeled'],0.6472222222222223
7306,closed,Nunting,2022-08-06 01:40:41+00:00,2022-08-06 17:34:44+00:00,objectives not available on mobile,['bug'],15.900833333333333
7303,closed,Jackson11500,2022-08-05 16:42:16+00:00,2022-08-05 18:25:45+00:00,malign incorrect draw layer while carried by oct,['bug'],1.7247222222222223
7302,closed,Jackson11500,2022-08-05 16:29:29+00:00,2022-08-05 18:25:46+00:00,duct won't automatic create bridge while crossing surge-conveyer,['bug'],1.9380555555555556
7300,closed,NIK3O3,2022-08-05 11:53:03+00:00,2022-08-05 13:38:36+00:00,game freezes when destroying blocks,['bug'],1.7591666666666668
7299,closed,Nunting,2022-08-05 11:28:39+00:00,2022-08-05 13:39:48+00:00,where is a heat?,['bug'],2.1858333333333335
7298,closed,FunkyPotao,2022-08-05 09:14:02+00:00,2022-08-05 13:38:19+00:00,duct bridges wont automatically getting placed when its on a reinforced conduit or bridge sometimes,['bug'],4.404722222222222
7296,closed,squi2rel,2022-08-05 03:54:13+00:00,2022-08-05 13:35:13+00:00,flux reactors can work when they are disabled and without any cyanogen,['bug'],9.683333333333334
7295,closed,Plastel,2022-08-05 03:54:12+00:00,2022-08-05 13:33:21+00:00,random crashes.,['unlabeled'],9.6525
7294,closed,Linnnnnna,2022-08-05 01:51:59+00:00,2022-08-05 04:37:38+00:00,serpulo's turret won't attack some erekir's blocks and core units,['bug'],2.7608333333333333
7292,closed,Linnnnnna,2022-08-04 23:31:09+00:00,2022-08-05 00:20:53+00:00,unit paytake/drop issues,['bug'],0.8288888888888889
7284,closed,MaciejGorczyca,2022-08-04 08:22:02+00:00,2022-08-04 14:24:00+00:00,poly in repair mode is stuck shooting at router and never hits/repairs it.,['bug'],6.032777777777778
7283,closed,MaciejGorczyca,2022-08-04 08:14:51+00:00,2022-08-04 14:14:21+00:00,lauching into new zone with core schematics will not connect power nodes and bridges,['bug'],5.991666666666666
7278,closed,TheMrAlbert,2022-08-03 04:16:09+00:00,2022-08-03 12:30:50+00:00,tutorial text in erekir are pixelated by a setting,['bug'],8.244722222222222
7277,closed,TheMrAlbert,2022-08-03 03:25:50+00:00,2022-08-03 12:29:55+00:00,ios did not give .zip file upon exporting data,['bug'],9.068055555555556
7276,closed,CellTaur,2022-08-02 23:25:46+00:00,2022-08-03 00:12:55+00:00,after game crash all sectors in campaign are under attack!,['unlabeled'],0.7858333333333334
7275,closed,MontraguExolum,2022-08-02 19:39:48+00:00,2022-08-02 23:16:39+00:00,i dont know wat is it,['unlabeled'],3.6141666666666667
7274,closed,YibYab,2022-08-02 17:53:19+00:00,2022-08-02 17:55:50+00:00,sublimate,['bug'],0.041944444444444444
7272,closed,xicscon,2022-08-02 10:50:34+00:00,2022-08-02 12:07:39+00:00,crash when joining server,['bug'],1.2847222222222223
7268,closed,renebrucknerjnr,2022-07-31 19:07:26+00:00,2022-07-31 22:47:59+00:00,scathe shooting both ground and air units,['bug'],3.6758333333333333
7267,closed,samurai2227777,2022-07-31 17:35:20+00:00,2022-07-31 17:41:04+00:00,невазможна выжыть в сектаре atlas,['unlabeled'],0.09555555555555556
7264,closed,Priohm,2022-07-31 17:07:02+00:00,2022-07-31 17:42:45+00:00,crash when joining multiplayer game in v7,['bug'],0.5952777777777778
7263,closed,Neil2101,2022-07-31 14:36:36+00:00,2022-07-31 14:55:37+00:00,command center throne in salt flats,['bug'],0.3169444444444444
7260,closed,PTALTS-LK,2022-07-31 02:36:45+00:00,2022-07-31 03:07:04+00:00,command mode prompt box will not be displayed in android be 22906.,['bug'],0.5052777777777778
7259,closed,Neil2101,2022-07-30 19:26:59+00:00,2022-07-31 02:33:46+00:00,briges and power nodes not linking,['bug'],7.1130555555555555
7257,closed,Fl414r,2022-07-30 13:28:15+00:00,2022-07-30 14:43:46+00:00,game freezes when poly try help me,['bug'],1.2586111111111111
7256,closed,Fabizocker456,2022-07-30 11:17:45+00:00,2022-07-30 14:05:09+00:00,plast/surge conveyors render weird,['bug'],2.79
7255,closed,Prosphyte,2022-07-29 18:25:36+00:00,2022-07-29 19:53:20+00:00,emptiness,['unlabeled'],1.4622222222222223
7254,closed,3Snake3,2022-07-29 09:31:53+00:00,2022-07-29 12:18:11+00:00,the game freezes when poly helps me dismantle buildings.,['bug'],2.7716666666666665
7246,closed,FredsMedia,2022-07-28 00:03:55+00:00,2022-07-28 13:16:22+00:00,[macos] random crash multiplayer 126.2,['bug'],13.2075
7245,closed,Orange1118,2022-07-27 14:20:10+00:00,2022-07-28 13:16:48+00:00,multiplayer error in android ,['bug'],22.94388888888889
7241,closed,JP16D,2022-07-25 16:04:53+00:00,2022-07-28 13:30:22+00:00,inconsistent status effect picture size in unit weapon display,['bug'],69.42472222222223
7239,closed,Jackson11500,2022-07-25 03:00:07+00:00,2022-07-28 13:26:37+00:00,unit drawn judgement bug,['bug'],82.44166666666666
7238,closed,ashybashy22,2022-07-25 00:10:05+00:00,2022-07-28 13:23:44+00:00,erekir liquid tank bug,['bug'],85.2275
7237,closed,misaga15,2022-07-24 16:55:03+00:00,2022-07-28 13:18:54+00:00,not an in-game bug,['unlabeled'],92.3975
7236,closed,Werenter,2022-07-24 12:33:59+00:00,2022-07-28 13:20:46+00:00,cliff crusher troubles,['unlabeled'],96.77972222222222
7234,closed,SukkaW,2022-07-24 07:56:31+00:00,2022-07-28 13:18:51+00:00,"[136.1] fail to join a server with ""unknown network error""",['bug'],101.37222222222222
7233,closed,Kevinindo02,2022-07-24 06:54:25+00:00,2022-07-28 13:19:04+00:00,having mono being freeze ,['bug'],102.41083333333333
7231,closed,shangjiaxuan,2022-07-23 19:03:58+00:00,2022-07-24 08:32:28+00:00,conveyor connection between `tetrative reconstructor` and `exponential reconstructor` not always working,['bug'],13.475
7228,closed,Piano23,2022-07-23 04:08:35+00:00,2022-07-23 17:02:31+00:00,hidden building in the onset campaign,['bug'],12.898888888888889
7227,closed,SoMall-dumpling,2022-07-23 03:17:57+00:00,2022-07-23 17:19:38+00:00,surge router,['bug'],14.028055555555556
7224,closed,Fabizocker456,2022-07-22 11:24:43+00:00,2022-07-22 14:31:40+00:00,js errors in contentinitevent crash the game,['bug'],3.1158333333333332
7223,closed,SoMall-dumpling,2022-07-22 08:59:54+00:00,2022-07-22 14:33:23+00:00,surge router,['bug'],5.558055555555556
7222,closed,SoMall-dumpling,2022-07-22 06:41:27+00:00,2022-07-22 08:48:07+00:00,armored duct again,['bug'],2.111111111111111
7219,closed,richlalsingh,2022-07-21 23:00:48+00:00,2022-07-22 01:23:49+00:00,"all power nodes, bridges, and conveyors disconnected after losing sector",['bug'],2.383611111111111
7218,closed,YellowAfterlife,2022-07-21 20:06:13+00:00,2022-07-22 01:23:08+00:00,"""collector"" achievement no longer triggers in v7",['bug'],5.281944444444444
7217,closed,madmagic007,2022-07-21 13:20:21+00:00,2022-07-21 14:48:18+00:00,roboticist achievement not being granted if units are built over multiple sessions,['bug'],1.4658333333333333
7216,closed,XtnehX,2022-07-21 10:39:21+00:00,2022-07-21 10:44:43+00:00,windows,['bug'],0.08944444444444444
7215,closed,XtnehX,2022-07-21 10:28:04+00:00,2022-07-21 10:42:59+00:00,windows,['bug'],0.24861111111111112
7214,closed,LIXEROGE,2022-07-21 10:08:44+00:00,2022-07-21 11:51:16+00:00,a bug,['unlabeled'],1.708888888888889
7213,closed,SoMall-dumpling,2022-07-21 09:49:42+00:00,2022-07-21 11:56:15+00:00,armored conveyor,['bug'],2.109166666666667
7212,closed,chenyning,2022-07-21 08:02:57+00:00,2022-07-21 11:51:28+00:00,区块波次出现问题,['bug'],3.808611111111111
7207,closed,Piano23,2022-07-20 04:59:51+00:00,2022-07-20 19:58:34+00:00,pulsars can't damage conveyors,['bug'],14.97861111111111
7201,closed,crazybim2,2022-07-19 13:04:42+00:00,2022-07-19 14:59:16+00:00,shard duping,['bug'],1.9094444444444445
7199,closed,Piano23,2022-07-19 12:01:00+00:00,2022-07-19 12:42:33+00:00,the game sometimes stuck for a long period of time,['bug'],0.6925
7198,closed,KellerKindAs,2022-07-19 10:42:54+00:00,2022-07-19 11:38:45+00:00,cryofluid mixer does not accept power on seperated power net,['unlabeled'],0.9308333333333333
7197,closed,VdobleMSG,2022-07-19 10:30:16+00:00,2022-07-19 10:35:33+00:00,launching in serpulo costs beryllium,['bug'],0.08805555555555555
7196,closed,sharkck,2022-07-19 05:29:24+00:00,2022-07-19 11:31:50+00:00,horizons are no longer able to carry resources/have no inventory,['bug'],6.040555555555556
7195,closed,sharkck,2022-07-19 04:51:55+00:00,2022-07-19 11:43:01+00:00,core schematics do not show on launch screen,['bug'],6.851666666666667
7194,closed,RealWetter,2022-07-18 19:45:11+00:00,2022-07-19 00:05:38+00:00,glidge vulnerable,['bug'],4.340833333333333
7193,closed,JwMango,2022-07-18 10:49:13+00:00,2022-07-18 14:01:34+00:00,vela's heal weapon visual bug,['bug'],3.2058333333333335
7188,closed,COALROCK8642,2022-07-17 13:57:41+00:00,2022-07-17 14:02:13+00:00,"ah, you forget to stop controls from working if escape menu is open.",['bug'],0.07555555555555556
7187,closed,SpookyCTT,2022-07-17 07:51:18+00:00,2022-07-17 11:49:05+00:00,bridge conduit issue,['bug'],3.9630555555555556
7184,closed,PineaFan,2022-07-16 18:59:15+00:00,2022-07-16 19:16:29+00:00,entering a turret another player is inside of crashes the game,['bug'],0.2872222222222222
7183,closed,nak-attak,2022-07-16 18:27:49+00:00,2022-07-16 18:45:42+00:00,tech tree instant completion,['bug'],0.2980555555555556
7180,closed,Anonymous-02,2022-07-16 09:49:53+00:00,2022-07-16 09:56:39+00:00,can't mine on erekir,['unlabeled'],0.11277777777777778
7178,closed,siede2010,2022-07-15 21:37:32+00:00,2022-07-15 23:26:28+00:00,old maps with objectives corrupt,['bug'],1.8155555555555556
7177,closed,NagameRlol,2022-07-15 20:43:03+00:00,2022-07-15 20:49:52+00:00,neoplasm unit modding bug,['bug'],0.11361111111111111
7176,closed,siede2010,2022-07-15 19:57:37+00:00,2022-07-15 20:30:29+00:00,objectives ui map update bug.,['bug'],0.5477777777777778
7169,closed,Jackson11500,2022-07-13 10:32:49+00:00,2022-07-13 12:56:53+00:00,oct&disrupt protects each other,['bug'],2.401111111111111
7168,closed,byzp,2022-07-13 06:09:44+00:00,2022-07-13 12:57:34+00:00,/,['bug'],6.7972222222222225
7167,closed,Jackson11500,2022-07-12 16:00:44+00:00,2022-07-12 17:50:13+00:00,elude crush the server,['bug'],1.8247222222222221
7166,closed,damonsmith,2022-07-12 13:01:17+00:00,2022-07-12 13:12:26+00:00,crash with packet error in multiplayer when putting down logic schematics,['bug'],0.18583333333333332
7161,closed,fl215,2022-07-10 15:57:10+00:00,2022-07-10 18:50:57+00:00,1 enemy core remaining but i destroyed all the cores?,['bug'],2.8963888888888887
7154,closed,IvanDem2009,2022-07-09 06:56:41+00:00,2022-07-09 11:40:21+00:00,vents,['bug'],4.727777777777778
7153,closed,Eclipse-04,2022-07-09 06:10:11+00:00,2022-07-09 11:41:07+00:00,payload loader can't load multiple items,['bug'],5.515555555555555
7149,closed,Jackson11500,2022-07-08 04:40:18+00:00,2022-07-08 11:54:42+00:00,erekir mech logic unit-control approach failed,"['bug', 'wontfix']",7.24
7148,closed,yanhuayilei,2022-07-08 03:03:50+00:00,2022-07-08 03:34:50+00:00,deconstructor,['unlabeled'],0.5166666666666667
7145,closed,HybridDeath,2022-07-07 18:18:25+00:00,2022-07-07 20:01:20+00:00,meltdown does not move its turret correctly,['bug'],1.7152777777777777
7144,closed,Hexrotor,2022-07-07 15:18:55+00:00,2022-07-07 15:30:57+00:00,@dead status is bugged,['bug'],0.20055555555555554
7143,closed,AnthonyPOLAR,2022-07-07 14:35:01+00:00,2022-07-07 15:09:05+00:00,problems with sector generation in editor,['unlabeled'],0.5677777777777778
7141,closed,DaGamerFiles,2022-07-07 01:22:57+00:00,2022-07-07 02:07:46+00:00,cannot change language to indonesia on android,['bug'],0.7469444444444444
7139,closed,SergSel2006,2022-07-06 22:35:45+00:00,2022-07-07 01:29:13+00:00,mindustry crashes when switching to system dark mode and vice versa ,['bug'],2.891111111111111
7133,closed,Jackson11500,2022-07-06 07:19:27+00:00,2022-07-06 11:37:21+00:00,quad rts ai bug,['bug'],4.298333333333333
7121,closed,TheMayhem6328,2022-07-04 11:42:35+00:00,2022-07-04 14:05:42+00:00,how is the name pronounced?,['unlabeled'],2.3852777777777776
7115,closed,divine-ray,2022-07-03 12:37:27+00:00,2022-07-03 13:43:23+00:00,erekir t5 constructor resets progress when offscreen,['bug'],1.0988888888888888
7100,closed,Eclipse-04,2022-06-30 14:39:38+00:00,2022-06-30 14:45:28+00:00,world processor can't flush print clipboard ,['bug'],0.09722222222222222
7087,closed,Blockzilla101,2022-06-28 09:38:05+00:00,2022-06-28 20:09:30+00:00,issue connecting to server,['bug'],10.52361111111111
7081,closed,Eclipse-04,2022-06-27 03:28:34+00:00,2022-06-27 13:47:01+00:00,unit clutch into walls and die,['unlabeled'],10.3075
7080,closed,ConfusedTick,2022-06-26 21:29:18+00:00,2022-06-26 21:31:35+00:00,error on server connecting.,['bug'],0.03805555555555556
7074,closed,stacktrace-error,2022-06-25 07:42:32+00:00,2022-06-25 12:54:04+00:00,specific ai types not working with modded units on non-wave teams,['bug'],5.192222222222222
7069,closed,dintomin,2022-06-24 14:51:25+00:00,2022-06-25 12:41:25+00:00,can't find public server and mods,['bug'],21.833333333333332
7064,closed,Corsh,2022-06-23 02:19:29+00:00,2022-06-23 11:33:48+00:00,bug report,['bug'],9.238611111111112
7063,closed,SandFogaz,2022-06-22 23:19:26+00:00,2022-06-22 23:48:41+00:00,start the game bug,['unlabeled'],0.4875
7061,closed,RusLeonid,2022-06-22 22:28:15+00:00,2022-06-22 22:31:56+00:00,rebuild targeting bug,['bug'],0.06138888888888889
7059,closed,LOICVAL42,2022-06-22 14:25:57+00:00,2022-06-22 14:32:36+00:00,translation error in french.,['bug'],0.11083333333333334
7058,closed,hublylol,2022-06-22 11:55:08+00:00,2022-06-22 14:33:09+00:00,resources tab constantly opening,['bug'],2.633611111111111
7057,closed,end-me-please,2022-06-22 09:05:06+00:00,2022-06-22 14:26:38+00:00,be crash in multiplayer,['bug'],5.358888888888889
7056,closed,hublylol,2022-06-22 07:56:42+00:00,2022-06-22 14:24:03+00:00,"commanding 8 units, one of them is a bit wonky",['bug'],6.4558333333333335
7050,closed,SiriusGold,2022-06-20 09:27:59+00:00,2022-06-20 14:32:02+00:00,mindustry bug,['unlabeled'],5.0675
7040,closed,hublylol,2022-06-18 09:56:47+00:00,2022-06-18 12:33:58+00:00,unit limit of salt flats first time launch is bugged,['bug'],2.6197222222222223
7039,closed,ahmadAria001,2022-06-18 08:08:08+00:00,2022-06-18 12:33:41+00:00,silicon smelter building crash,['bug'],4.425833333333333
7035,closed,wojtmic,2022-06-17 15:26:03+00:00,2022-06-17 16:09:05+00:00,game crashing with local server,['bug'],0.7172222222222222
7033,closed,Eschatologue,2022-06-17 08:12:06+00:00,2022-06-17 12:52:10+00:00,multiple weapon outlines generation for modded units 2: electric bogaloo,['bug'],4.667777777777777
7031,closed,SunmineGithub,2022-06-17 05:01:24+00:00,2022-06-17 12:00:35+00:00,report,['unlabeled'],6.9863888888888885
7030,closed,Lotertoi,2022-06-16 23:27:05+00:00,2022-06-16 23:37:49+00:00,progress loss,['bug'],0.17888888888888888
